{
  "schemaVersion": 1,
  "candidateId": "pre-cft-compat",
  "run": 1,
  "startedAt": "2026-07-28T11:00:00.000Z",
  "finishedAt": "2026-07-28T11:00:03.000Z",
  "coldStart": true,
  "profileMode": "fresh",
  "nodeProcessFresh": true,
  "browserProcessFresh": true,
  "nodeExitCode": 0,
  "browserStarted": true,
  "browserExecutable": "browsers/playwright-managed-browser/chrome.exe",
  "usedSystemBrowser": false,
  "browserDownloadAttempted": false,
  "adminRequired": false,
  "installRequired": false,
  "target": "live-site",
  "locator": "[data-presenter-id=\"page-tomorrow\"] a[data-event-id=\"fixture-event\"]",
  "action": "locator.click",
  "successMarkerVisible": true,
  "liveRouteSuccess": true,
  "liveContentSuccess": true,
  "orphanProcesses": [],
  "screenshot": "runs/pre-cft-compat/live-01.png",
  "trace": "runs/pre-cft-compat/live-01.zip",
  "error": null
}
